<?xml version="1.0" encoding="utf-8"?>
<types xmlns:xsi="http://www.w3.org/2001/XMLSchema-instance" xsi:noNamespaceSchemaLocation="../lang-types.xsd">
	<type id="1">표준</type>
	<type id="2">싸움</type>
	<type id="3">비행</type>
	<type id="4">독</type>
	<type id="5">바닥</type>
	<type id="6">록</type>
	<type id="7">버그</type>
	<type id="8">유령</type>
	<type id="9">강철</type>
	<type id="10">화재</type>
	<type id="11">물</type>
	<type id="12">잔디</type>
	<type id="13">전기의</type>
	<type id="14">무당</type>
	<type id="15">얼음</type>
	<type id="16">용</type>
	<type id="17">어두운</type>
	<type id="18">요정</type>
</types>