<?xml version="1.0" encoding="utf-8"?>
<types xmlns:xsi="http://www.w3.org/2001/XMLSchema-instance" xsi:noNamespaceSchemaLocation="../lang-types.xsd">
	<type id="1">Normal</type>
	<type id="2">Kampf</type>
	<type id="3">Flug</type>
	<type id="4">Gift</type>
	<type id="5">Boden</type>
	<type id="6">Gestein</type>
	<type id="7">KÃ¤fer</type>
	<type id="8">Geist</type>
	<type id="9">Stahl</type>
	<type id="10">Feuer</type>
	<type id="11">Wasser</type>
	<type id="12">Pflanze</type>
	<type id="13">Electro</type>
	<type id="14">Psycho</type>
	<type id="15">Eis</type>
	<type id="16">Drachen</type>
	<type id="17">Unlicht</type>
	<type id="18">Fee</type>
</types>