<?xml version="1.0" encoding="utf-8"?>
<types xmlns:xsi="http://www.w3.org/2001/XMLSchema-instance" xsi:noNamespaceSchemaLocation="../lang-types.xsd">
	<type id="1">
		<type id="1">1</type>
		<type id="2">1</type>
		<type id="3">1</type>
		<type id="4">1</type>
		<type id="5">1</type>
		<type id="6">0.8</type>
		<type id="7">1</type>
		<type id="8">0.8</type>
		<type id="9">0.8</type>
		<type id="10">1</type>
		<type id="11">1</type>
		<type id="12">1</type>
		<type id="13">1</type>
		<type id="14">1</type>
		<type id="15">1</type>
		<type id="16">1</type>
		<type id="17">1</type>
		<type id="18">1</type>
	</type>
	<type id="2">
		<type id="1">1.25</type>
		<type id="2">1</type>
		<type id="3">0.8</type>
		<type id="4">0.8</type>
		<type id="5">1</type>
		<type id="6">1.25</type>
		<type id="7">0.8</type>
		<type id="8">0.8</type>
		<type id="9">1.25</type>
		<type id="10">1</type>
		<type id="11">1</type>
		<type id="12">1</type>
		<type id="13">1</type>
		<type id="14">0.8</type>
		<type id="15">1.25</type>
		<type id="16">1</type>
		<type id="17">1.25</type>
		<type id="18">0.8</type>
	</type>
	<type id="3">
		<type id="1">1</type>
		<type id="2">1.25</type>
		<type id="3">1</type>
		<type id="4">1</type>
		<type id="5">1</type>
		<type id="6">0.8</type>
		<type id="7">1.25</type>
		<type id="8">1</type>
		<type id="9">0.8</type>
		<type id="10">1</type>
		<type id="11">1</type>
		<type id="12">1.25</type>
		<type id="13">0.8</type>
		<type id="14">1</type>
		<type id="15">1</type>
		<type id="16">1</type>
		<type id="17">1</type>
		<type id="18">1</type>
	</type>
	<type id="4">
		<type id="1">1</type>
		<type id="2">1</type>
		<type id="3">1</type>
		<type id="4">0.8</type>
		<type id="5">0.8</type>
		<type id="6">0.8</type>
		<type id="7">1</type>
		<type id="8">0.8</type>
		<type id="9">0.8</type>
		<type id="10">1</type>
		<type id="11">1</type>
		<type id="12">1.25</type>
		<type id="13">1</type>
		<type id="14">1</type>
		<type id="15">1</type>
		<type id="16">1</type>
		<type id="17">1</type>
		<type id="18">1.25</type>
	</type>
	<type id="5">
		<type id="1">1</type>
		<type id="2">1</type>
		<type id="3">0.8</type>
		<type id="4">1.25</type>
		<type id="5">1</type>
		<type id="6">1.25</type>
		<type id="7">0.8</type>
		<type id="8">1</type>
		<type id="9">1.25</type>
		<type id="10">1.25</type>
		<type id="11">1</type>
		<type id="12">0.8</type>
		<type id="13">1.25</type>
		<type id="14">1</type>
		<type id="15">1</type>
		<type id="16">1</type>
		<type id="17">1</type>
		<type id="18">1</type>
	</type>
	<type id="6">
		<type id="1">1</type>
		<type id="2">0.8</type>
		<type id="3">1.25</type>
		<type id="4">1</type>
		<type id="5">0.8</type>
		<type id="6">1</type>
		<type id="7">1.25</type>
		<type id="8">1</type>
		<type id="9">0.8</type>
		<type id="10">1.25</type>
		<type id="11">1</type>
		<type id="12">1</type>
		<type id="13">1</type>
		<type id="14">1</type>
		<type id="15">1.25</type>
		<type id="16">1</type>
		<type id="17">1</type>
		<type id="18">1</type>
	</type>
	<type id="7">
		<type id="1">1</type>
		<type id="2">0.8</type>
		<type id="3">0.8</type>
		<type id="4">0.8</type>
		<type id="5">1</type>
		<type id="6">1</type>
		<type id="7">1</type>
		<type id="8">0.8</type>
		<type id="9">0.8</type>
		<type id="10">0.8</type>
		<type id="11">1</type>
		<type id="12">1.25</type>
		<type id="13">1</type>
		<type id="14">1.25</type>
		<type id="15">1</type>
		<type id="16">1</type>
		<type id="17">1.25</type>
		<type id="18">0.8</type>
	</type>
	<type id="8">
		<type id="1">0.8</type>
		<type id="2">1</type>
		<type id="3">1</type>
		<type id="4">1</type>
		<type id="5">1</type>
		<type id="6">1</type>
		<type id="7">1</type>
		<type id="8">1.25</type>
		<type id="9">1</type>
		<type id="10">1</type>
		<type id="11">1</type>
		<type id="12">1</type>
		<type id="13">1</type>
		<type id="14">1.25</type>
		<type id="15">1</type>
		<type id="16">1</type>
		<type id="17">0.8</type>
		<type id="18">1</type>
	</type>
	<type id="9">
		<type id="1">1</type>
		<type id="2">1</type>
		<type id="3">1</type>
		<type id="4">1</type>
		<type id="5">1</type>
		<type id="6">1.25</type>
		<type id="7">1</type>
		<type id="8">1</type>
		<type id="9">0.8</type>
		<type id="10">0.8</type>
		<type id="11">0.8</type>
		<type id="12">1</type>
		<type id="13">0.8</type>
		<type id="14">1</type>
		<type id="15">1.25</type>
		<type id="16">1</type>
		<type id="17">1</type>
		<type id="18">1.25</type>
	</type>
	<type id="10">
		<type id="1">1</type>
		<type id="2">1</type>
		<type id="3">1</type>
		<type id="4">1</type>
		<type id="5">1</type>
		<type id="6">0.8</type>
		<type id="7">1.25</type>
		<type id="8">1</type>
		<type id="9">1.25</type>
		<type id="10">0.8</type>
		<type id="11">0.8</type>
		<type id="12">1.25</type>
		<type id="13">1</type>
		<type id="14">1</type>
		<type id="15">1.25</type>
		<type id="16">0.8</type>
		<type id="17">1</type>
		<type id="18">1</type>
	</type>
	<type id="11">
		<type id="1">1</type>
		<type id="2">1</type>
		<type id="3">1</type>
		<type id="4">1</type>
		<type id="5">1.25</type>
		<type id="6">1.25</type>
		<type id="7">1</type>
		<type id="8">1</type>
		<type id="9">1</type>
		<type id="10">1.25</type>
		<type id="11">0.8</type>
		<type id="12">0.8</type>
		<type id="13">1</type>
		<type id="14">1</type>
		<type id="15">1</type>
		<type id="16">0.8</type>
		<type id="17">1</type>
		<type id="18">1</type>
	</type>
	<type id="12">
		<type id="1">1</type>
		<type id="2">1</type>
		<type id="3">0.8</type>
		<type id="4">0.8</type>
		<type id="5">1.25</type>
		<type id="6">1.25</type>
		<type id="7">0.8</type>
		<type id="8">1</type>
		<type id="9">0.8</type>
		<type id="10">0.8</type>
		<type id="11">1.25</type>
		<type id="12">0.8</type>
		<type id="13">1</type>
		<type id="14">1</type>
		<type id="15">1</type>
		<type id="16">0.8</type>
		<type id="17">1</type>
		<type id="18">1</type>
	</type>
	<type id="13">
		<type id="1">1</type>
		<type id="2">1</type>
		<type id="3">1.25</type>
		<type id="4">1</type>
		<type id="5">0.89</type>
		<type id="6">1</type>
		<type id="7">1</type>
		<type id="8">1</type>
		<type id="9">1</type>
		<type id="10">1</type>
		<type id="11">1.25</type>
		<type id="12">0.8</type>
		<type id="13">0.8</type>
		<type id="14">1</type>
		<type id="15">1</type>
		<type id="16">0.8</type>
		<type id="17">1</type>
		<type id="18">1</type>
	</type>
	<type id="14">
		<type id="1">1</type>
		<type id="2">1.25</type>
		<type id="3">1</type>
		<type id="4">1.25</type>
		<type id="5">1</type>
		<type id="6">1</type>
		<type id="7">1</type>
		<type id="8">1</type>
		<type id="9">0.8</type>
		<type id="10">1</type>
		<type id="11">1</type>
		<type id="12">1</type>
		<type id="13">1</type>
		<type id="14">0.8</type>
		<type id="15">1</type>
		<type id="16">1</type>
		<type id="17">0.8</type>
		<type id="18">1</type>
	</type>
	<type id="15">
		<type id="1">1</type>
		<type id="2">1</type>
		<type id="3">1.25</type>
		<type id="4">1</type>
		<type id="5">1.25</type>
		<type id="6">1</type>
		<type id="7">1</type>
		<type id="8">1</type>
		<type id="9">0.8</type>
		<type id="10">0.8</type>
		<type id="11">0.8</type>
		<type id="12">1.25</type>
		<type id="13">1</type>
		<type id="14">1</type>
		<type id="15">0.8</type>
		<type id="16">1.25</type>
		<type id="17">1</type>
		<type id="18">1</type>
	</type>
	<type id="16">
		<type id="1">1</type>
		<type id="2">1</type>
		<type id="3">1</type>
		<type id="4">1</type>
		<type id="5">1</type>
		<type id="6">1</type>
		<type id="7">1</type>
		<type id="8">1</type>
		<type id="9">0.8</type>
		<type id="10">1</type>
		<type id="11">1</type>
		<type id="12">1</type>
		<type id="13">1</type>
		<type id="14">1</type>
		<type id="15">1</type>
		<type id="16">1.25</type>
		<type id="17">1</type>
		<type id="18">0.8</type>
	</type>
	<type id="17">
		<type id="1">1</type>
		<type id="2">0.8</type>
		<type id="3">1</type>
		<type id="4">1</type>
		<type id="5">1</type>
		<type id="6">1</type>
		<type id="7">1</type>
		<type id="8">1.25</type>
		<type id="9">1</type>
		<type id="10">1</type>
		<type id="11">1</type>
		<type id="12">1</type>
		<type id="13">1</type>
		<type id="14">1.25</type>
		<type id="15">1</type>
		<type id="16">1</type>
		<type id="17">0.8</type>
		<type id="18">0.8</type>
	</type>
	<type id="18">
		<type id="1">1</type>
		<type id="2">1.25</type>
		<type id="3">1</type>
		<type id="4">0.8</type>
		<type id="5">1</type>
		<type id="6">1</type>
		<type id="7">1</type>
		<type id="8">1</type>
		<type id="9">0.8</type>
		<type id="10">0.8</type>
		<type id="11">1</type>
		<type id="12">1</type>
		<type id="13">1</type>
		<type id="14">1</type>
		<type id="15">1</type>
		<type id="16">1.25</type>
		<type id="17">1.25</type>
		<type id="18">1</type>
	</type>
</types>
