<?xml version="1.0" encoding="utf-8"?>
<types xmlns:xsi="http://www.w3.org/2001/XMLSchema-instance" xsi:noNamespaceSchemaLocation="../lang-types.xsd">
	<type id="1">Normal</type>
	<type id="2">Fighting</type>
	<type id="3">Flying</type>
	<type id="4">Poison</type>
	<type id="5">Ground</type>
	<type id="6">Rock</type>
	<type id="7">Bug</type>
	<type id="8">Ghost</type>
	<type id="9">Steel</type>
	<type id="10">Fire</type>
	<type id="11">Water</type>
	<type id="12">Grass</type>
	<type id="13">Electric</type>
	<type id="14">Psychic</type>
	<type id="15">Ice</type>
	<type id="16">Dragon</type>
	<type id="17">Dark</type>
	<type id="18">Fairy</type>
</types>